[
  {
    "id": "nucleo",
    "nombre": "Núcleo",
    "descripcion": "50 ítems generales que posicionan en los ejes principales y sirven para el perfil y el matching electoral provisional.",
    "orden": 1,
    "desbloqueo": { "tipo": "siempre" }
  },
  {
    "id": "corrientes-izquierda",
    "nombre": "Corrientes de la izquierda",
    "descripcion": "Reforma/revolución, vanguardia/consejos, plan/mercado, internacionalismo, balance de la URSS, anarquismo y asamblearismo. Separa marxismo-leninismo, maoísmo, trotskismo, luxemburguismo, anarcocomunismo, rojipardismo y socialdemocracia.",
    "orden": 2,
    "eleccionUsuario": true,
    "desbloqueo": { "tipo": "eje", "eje": "economico", "operador": "<=", "umbral": -40 }
  },
  {
    "id": "socialdemocracia-reformismo",
    "nombre": "Socialdemocracia y reformismo",
    "descripcion": "Tercera vía, socialismo democrático, ecosocialismo reformista, populismo de izquierda y socialdemocracia antinacionalista. Separa PSOE, Sumar, Podemos, Más Madrid e Izquierda Española.",
    "orden": 3,
    "eleccionUsuario": true,
    "desbloqueo": { "tipo": "eje-banda", "eje": "economico", "min": -60, "max": 5 }
  },
  {
    "id": "centro-liberalismo",
    "nombre": "Centro y liberalismo",
    "descripcion": "Socioliberalismo, liberalismo clásico, libertarianismo/anarcocapitalismo, centrismo pragmático y tecnocracia. Separa al liberal progresista del conservador liberal y del ancap.",
    "orden": 4,
    "eleccionUsuario": true,
    "desbloqueo": { "tipo": "eje-banda", "eje": "economico", "min": -15, "max": 60 }
  },
  {
    "id": "corrientes-derecha",
    "nombre": "Corrientes de la derecha",
    "descripcion": "Democracia cristiana, conservadurismo liberal, tradicionalismo, agrarismo y tecnocracia. Derecha liberal en costumbres (línea pro-LGTB) vs. derecha moral; economía social de mercado vs. liberalismo duro.",
    "orden": 5,
    "eleccionUsuario": true,
    "desbloqueo": { "tipo": "eje", "eje": "economico", "operador": ">=", "umbral": 40 }
  },
  {
    "id": "derecha-radical",
    "nombre": "Derecha radical y ultraderecha",
    "descripcion": "Nacional-conservadurismo liberal (VOX), falangismo/nacionalsindicalismo, identitarismo nativista, populismo digital antipolítico y nacional-catolicismo. Separa lo que la etiqueta «extrema derecha» esconde.",
    "orden": 6,
    "eleccionUsuario": true,
    "desbloqueo": { "tipo": "eje", "eje": "social", "operador": ">=", "umbral": 40 }
  },
  {
    "id": "nacionalismos-regionalismos",
    "nombre": "Nacionalismos y regionalismos",
    "descripcion": "Vía unilateral/pactada, independencia/confederalismo/foralismo, nación cívica/cultural, pactismo territorial y España vaciada. Común a todos los nacionalismos periféricos y regionalismos.",
    "orden": 7,
    "eleccionUsuario": true,
    "desbloqueo": { "tipo": "eje-o-ccaa", "eje": "territorial", "operador": "<=", "umbral": -30, "ccaa": ["andalucia", "castilla-y-leon", "catalunya"] }
  },
  {
    "id": "verde-animalista",
    "nombre": "Ecologismo y animalismo",
    "descripcion": "Derechos de los animales vs. bienestarismo, decrecimiento vs. crecimiento verde, nuclear, renovables vs. territorio, caza y tauromaquia. Separa PACMA, verdes, ecosocialistas y ecomodernistas.",
    "orden": 8,
    "eleccionUsuario": true,
    "desbloqueo": { "tipo": "eje", "eje": "ecologia", "operador": ">=", "umbral": 30 }
  },
  {
    "id": "feminismos-moral",
    "nombre": "Feminismos y moral pública",
    "descripcion": "Abolicionismo/regulacionismo, autodeterminación de género, gestación subrogada, bioética y laicismo. Los cortes que parten en dos tanto a la izquierda como a la derecha.",
    "orden": 9,
    "eleccionUsuario": true,
    "desbloqueo": { "tipo": "eje-banda", "eje": "social", "min": -100, "max": 20 }
  },
  {
    "id": "territorial-canarias",
    "nombre": "Territorial: Canarias",
    "descripcion": "REF, insularidad, ultraperiferia, descuento de residente, moratoria turística, frontera sur. Plantilla replicable para el resto de CCAA.",
    "orden": 10,
    "eleccionUsuario": true,
    "desbloqueo": { "tipo": "ccaa", "ccaa": "canarias" }
  },
  {
    "id": "territorial-catalunya",
    "nombre": "Territorial: Catalunya",
    "descripcion": "Independentismo (todas sus familias), inmersión lingüística, financiación singular y el cruce único de Aliança Catalana.",
    "orden": 11,
    "eleccionUsuario": true,
    "desbloqueo": { "tipo": "ccaa", "ccaa": "catalunya" }
  },
  {
    "id": "territorial-euskadi-navarra",
    "nombre": "Territorial: Euskadi y Navarra",
    "descripcion": "Concierto económico, foralismo y soberanía, Navarra en Euskal Herria, euskera, memoria, víctimas, violencia y estrategia democrática.",
    "orden": 12,
    "eleccionUsuario": true,
    "desbloqueo": { "tipo": "ccaa", "ccaa": ["euskadi", "navarra"] }
  },
  {
    "id": "territorial-galicia",
    "nombre": "Territorial: Galicia",
    "descripcion": "Galeguismo, lengua, industria electrointensiva, litoral y mar.",
    "orden": 13,
    "eleccionUsuario": true,
    "desbloqueo": { "tipo": "ccaa", "ccaa": "galicia" }
  },
  {
    "id": "territorial-andalucia",
    "nombre": "Territorial: Andalucía",
    "descripcion": "Andalucismo soberanista e institucional, sucursalismo, mundo jornalero, turismo y vivienda.",
    "orden": 14,
    "eleccionUsuario": true,
    "desbloqueo": { "tipo": "ccaa", "ccaa": "andalucia" }
  },
  {
    "id": "democracia-instituciones",
    "nombre": "Democracia, instituciones y toma de decisiones",
    "descripcion": "Parlamentarismo y sus alternativas, democracia directa, revocación, reelección, separación de poderes, elección de jueces, organización interna y arquitectura territorial unitaria, autonómica, federal o confederal.",
    "orden": 15,
    "eleccionUsuario": true,
    "desbloqueo": { "tipo": "siempre" }
  },
  {
    "id": "trabajo-estado-sindicatos",
    "nombre": "Trabajo, Estado y sindicatos",
    "descripcion": "Poder en el centro de trabajo, autonomía sindical, cogestión, corporativismo, sindicalismo revolucionario y distintos motivos para rechazar impuestos o intervención estatal.",
    "orden": 16,
    "eleccionUsuario": true,
    "desbloqueo": { "tipo": "siempre" }
  },
  {
    "id": "energia-modelo-productivo",
    "nombre": "Energía y modelo productivo",
    "descripcion": "Energía nuclear civil, renovables, propiedad de la red, límites al consumo y distintas estrategias climáticas sin identificar ecologismo con antinuclearismo.",
    "orden": 17,
    "eleccionUsuario": true,
    "desbloqueo": { "tipo": "siempre" }
  },
  {
    "id": "geopolitica-defensa",
    "nombre": "Geopolítica, defensa y paz",
    "descripcion": "Pacifismo, intervención, neutralidad, OTAN, armas nucleares, Sáhara Occidental, reclamaciones históricas e hipótesis de integración ibérica.",
    "orden": 18,
    "eleccionUsuario": true,
    "desbloqueo": { "tipo": "siempre" }
  },
  {
    "id": "limites-antipluralismo",
    "nombre": "Límites del pluralismo y del uso de la violencia",
    "descripcion": "Bloque opcional de investigación sobre concentración extrema de poder, culto a la dirección y aceleración violenta del colapso. Solo alimenta el mapa; nunca recomienda partidos u organizaciones reales.",
    "orden": 19,
    "eleccionUsuario": true,
    "desbloqueo": { "tipo": "manual" }
  }
]
